[
  {
    "id": "stem:phys:0001",
    "domain": "physics",
    "term": "velocity",
    "ru_translation": "скорость",
    "symbol": "v, m/s",
    "en_definition": "The rate of change of position of an object in a particular direction.",
    "csca_example": "The particle moves with a constant velocity of 5 m/s along the x-axis."
  },
  {
    "id": "stem:phys:0002",
    "domain": "physics",
    "term": "acceleration",
    "ru_translation": "ускорение",
    "symbol": "a, m/s²",
    "en_definition": "The rate of change of velocity with respect to time.",
    "csca_example": "A car undergoes uniform acceleration of 2 m/s² starting from rest."
  },
  {
    "id": "stem:phys:0003",
    "domain": "physics",
    "term": "displacement",
    "ru_translation": "перемещение",
    "symbol": "s, m",
    "en_definition": "The change in position of an object, a vector quantity with magnitude and direction.",
    "csca_example": "The displacement of the object after 4 seconds is 32 meters to the north."
  },
  {
    "id": "stem:phys:0004",
    "domain": "physics",
    "term": "distance",
    "ru_translation": "расстояние",
    "symbol": "d, m",
    "en_definition": "The total length of the path traveled by an object, a scalar quantity.",
    "csca_example": "The runner covers a distance of 400 meters in the race."
  },
  {
    "id": "stem:phys:0005",
    "domain": "physics",
    "term": "kinematics",
    "ru_translation": "кинематика",
    "symbol": null,
    "en_definition": "The branch of mechanics that describes motion without considering forces.",
    "csca_example": "In kinematics problems, we analyze the motion equations for uniformly accelerated motion."
  },
  {
    "id": "stem:phys:0006",
    "domain": "physics",
    "term": "initial velocity",
    "ru_translation": "начальная скорость",
    "symbol": "v₀, m/s",
    "en_definition": "The velocity of an object at the beginning of the time interval being analyzed.",
    "csca_example": "A projectile is launched with an initial velocity of 20 m/s at an angle of 45 degrees."
  },
  {
    "id": "stem:phys:0007",
    "domain": "physics",
    "term": "final velocity",
    "ru_translation": "конечная скорость",
    "symbol": "v, m/s",
    "en_definition": "The velocity of an object at the end of the time interval being analyzed.",
    "csca_example": "Calculate the final velocity of the object after traveling for 5 seconds."
  },
  {
    "id": "stem:phys:0008",
    "domain": "physics",
    "term": "free fall",
    "ru_translation": "свободное падение",
    "symbol": "g, m/s²",
    "en_definition": "Motion of an object under the influence of gravitational force only, without air resistance.",
    "csca_example": "An object in free fall near Earth's surface experiences a constant acceleration of 10 m/s²."
  },
  {
    "id": "stem:phys:0009",
    "domain": "physics",
    "term": "uniform motion",
    "ru_translation": "равномерное движение",
    "symbol": null,
    "en_definition": "Motion at constant velocity, where acceleration equals zero.",
    "csca_example": "A train moves at uniform motion along a straight track at 50 m/s."
  },
  {
    "id": "stem:phys:0010",
    "domain": "physics",
    "term": "uniformly accelerated motion",
    "ru_translation": "равноускоренное движение",
    "symbol": null,
    "en_definition": "Motion with constant acceleration, where velocity changes linearly with time.",
    "csca_example": "The body undergoes uniformly accelerated motion with an acceleration of 3 m/s²."
  },
  {
    "id": "stem:phys:0011",
    "domain": "physics",
    "term": "initially at rest",
    "ru_translation": "начально в покое",
    "symbol": null,
    "en_definition": "Starting condition where the initial velocity is zero at the beginning of motion.",
    "csca_example": "A block is initially at rest on a horizontal surface and then pushed with a force."
  },
  {
    "id": "stem:phys:0012",
    "domain": "physics",
    "term": "projectile motion",
    "ru_translation": "движение тела под углом",
    "symbol": null,
    "en_definition": "Motion of an object launched into the air under the influence of gravity only.",
    "csca_example": "A ball is thrown horizontally from a height, exhibiting projectile motion."
  },
  {
    "id": "stem:phys:0013",
    "domain": "physics",
    "term": "force",
    "ru_translation": "сила",
    "symbol": "F, N",
    "en_definition": "A vector quantity that causes an object to accelerate or change direction.",
    "csca_example": "A force of 10 N is applied horizontally to a block on a smooth surface."
  },
  {
    "id": "stem:phys:0014",
    "domain": "physics",
    "term": "mass",
    "ru_translation": "масса",
    "symbol": "m, kg",
    "en_definition": "A measure of the amount of matter in an object and its resistance to acceleration.",
    "csca_example": "An object with a mass of 5 kg is subjected to a force of 20 N."
  },
  {
    "id": "stem:phys:0015",
    "domain": "physics",
    "term": "weight",
    "ru_translation": "вес",
    "symbol": "W, N",
    "en_definition": "The force exerted on an object due to gravity, equal to mass times gravitational acceleration.",
    "csca_example": "The weight of a 10 kg object on Earth is approximately 100 N."
  },
  {
    "id": "stem:phys:0016",
    "domain": "physics",
    "term": "Newton's first law",
    "ru_translation": "первый закон Ньютона",
    "symbol": null,
    "en_definition": "An object at rest remains at rest and an object in motion remains in motion unless acted upon by a net force.",
    "csca_example": "According to Newton's first law, the object continues moving at constant velocity on a frictionless surface."
  },
  {
    "id": "stem:phys:0017",
    "domain": "physics",
    "term": "Newton's second law",
    "ru_translation": "второй закон Ньютона",
    "symbol": "F = ma",
    "en_definition": "The net force on an object equals its mass multiplied by its acceleration.",
    "csca_example": "By Newton's second law, the acceleration of the object is calculated as force divided by mass."
  },
  {
    "id": "stem:phys:0018",
    "domain": "physics",
    "term": "Newton's third law",
    "ru_translation": "третий закон Ньютона",
    "symbol": null,
    "en_definition": "For every action force, there is an equal and opposite reaction force.",
    "csca_example": "Newton's third law states that when a ball hits a wall, the wall exerts an equal force on the ball."
  },
  {
    "id": "stem:phys:0019",
    "domain": "physics",
    "term": "friction force",
    "ru_translation": "сила трения",
    "symbol": "f, N",
    "en_definition": "A force that opposes the relative motion between two surfaces in contact.",
    "csca_example": "The friction force between the block and the surface is 15 N."
  },
  {
    "id": "stem:phys:0020",
    "domain": "physics",
    "term": "normal force",
    "ru_translation": "сила нормальной реакции",
    "symbol": "N, N",
    "en_definition": "The perpendicular contact force exerted by a surface on an object.",
    "csca_example": "The normal force acting on the book resting on the table equals its weight."
  },
  {
    "id": "stem:phys:0021",
    "domain": "physics",
    "term": "frictionless surface",
    "ru_translation": "поверхность без трения",
    "symbol": null,
    "en_definition": "An idealized surface with no friction, allowing objects to slide without resistance.",
    "csca_example": "A block slides down a frictionless surface with only gravity acting on it."
  },
  {
    "id": "stem:phys:0022",
    "domain": "physics",
    "term": "tension",
    "ru_translation": "натяжение",
    "symbol": "T, N",
    "en_definition": "The force transmitted through a rope, cable, or string when it is pulled at both ends.",
    "csca_example": "The tension in the rope is equal to the weight of the suspended object."
  },
  {
    "id": "stem:phys:0023",
    "domain": "physics",
    "term": "gravitational force",
    "ru_translation": "сила гравитации",
    "symbol": "Fg, N",
    "en_definition": "The attractive force exerted between two masses, given by Newton's law of universal gravitation.",
    "csca_example": "The gravitational force between the Earth and an object determines the object's weight."
  },
  {
    "id": "stem:phys:0024",
    "domain": "physics",
    "term": "elastic force",
    "ru_translation": "упругая сила",
    "symbol": "Fe, N",
    "en_definition": "The restoring force exerted by a deformed elastic object, described by Hooke's law.",
    "csca_example": "The elastic force in a compressed spring is proportional to the compression distance."
  },
  {
    "id": "stem:phys:0025",
    "domain": "physics",
    "term": "work",
    "ru_translation": "работа",
    "symbol": "W, J",
    "en_definition": "The energy transferred by a force acting on an object as it moves in the direction of the force.",
    "csca_example": "The work done by the force on the object is calculated as force times displacement."
  },
  {
    "id": "stem:phys:0026",
    "domain": "physics",
    "term": "kinetic energy",
    "ru_translation": "кинетическая энергия",
    "symbol": "Ek, J",
    "en_definition": "The energy possessed by an object due to its motion, equal to one-half mass times velocity squared.",
    "csca_example": "The kinetic energy of the moving car increases as its velocity increases."
  },
  {
    "id": "stem:phys:0027",
    "domain": "physics",
    "term": "potential energy",
    "ru_translation": "потенциальная энергия",
    "symbol": "Ep, J",
    "en_definition": "The energy possessed by an object due to its position or state, relative to a reference point.",
    "csca_example": "The potential energy of an object at height h above the ground is mgh."
  },
  {
    "id": "stem:phys:0028",
    "domain": "physics",
    "term": "power",
    "ru_translation": "мощность",
    "symbol": "P, W",
    "en_definition": "The rate at which work is done or energy is transferred, measured in watts.",